[
  {
    "recorded_at": "2026-07-28T09:15:00Z",
    "description": "Heavy, foggy feeling and difficulty finding words",
    "body_area": "head",
    "intensity_0_to_10": 6,
    "duration_minutes": 90,
    "pattern": "Worse after sustained concentration",
    "context": "After a 45-minute video meeting",
    "possible_triggers": ["long meeting", "poor sleep"],
    "functional_impact": "Needed a quiet break before continuing work",
    "medication_note": "No change",
    "free_text_note": "Synthetic example only",
    "tags": ["cognitive", "morning"]
  }
]

